{
  "schema": "ResonariumBiosentinelExperiment",
  "version": 1,
  "seed": "17468934514447348100",
  "seedAlgorithm": "blake2b-64-be",
  "engine": "portable-mulberry32-boxmuller-v1",
  "config": {
    "N": 64,
    "depth": 7,
    "J0": 1.0,
    "ratio": 2.2,
    "intensity_mw": 1000.0,
    "kappa": 0.011,
    "K_max": 12.0,
    "dt": 0.008,
    "n": 16,
    "k": 0.72,
    "omega_std": 0.45
  },
  "units": {
    "intensity": "mW/cm2",
    "duration_ms": "ms",
    "fluence": "J/cm2",
    "t": "s",
    "K": "model units"
  },
  "symbols": "LSLLSLSLLSLLSLSLLSLSL",
  "trajectory": [
    {
      "index": 0,
      "symbol": "L",
      "intensity": 1483.2396974191327,
      "duration_ms": 674.1998624632421,
      "fluence": 1.0,
      "K": 0.01631563667161046,
      "R_mean": 0.1290430516069003,
      "psi": 3.086203366689089,
      "t": 0.674199862463242
    },
    {
      "index": 1,
      "symbol": "S",
      "intensity": 674.1998624632421,
      "duration_ms": 1483.2396974191327,
      "fluence": 1.0,
      "K": 0.007416198487095662,
      "R_mean": 0.21934287277455888,
      "psi": -2.9687957365928574,
      "t": 2.157439559882375
    },
    {
      "index": 2,
      "symbol": "L",
      "intensity": 1483.2396974191327,
      "duration_ms": 674.1998624632421,
      "fluence": 1.0,
      "K": 0.01631563667161046,
      "R_mean": 0.23957833663387756,
      "psi": -2.611714842212292,
      "t": 2.8316394223456167
    },
    {
      "index": 3,
      "symbol": "L",
      "intensity": 1483.2396974191327,
      "duration_ms": 674.1998624632421,
      "fluence": 1.0,
      "K": 0.01631563667161046,
      "R_mean": 0.2047389693882549,
      "psi": -2.3461620921295525,
      "t": 3.5058392848088586
    },
    {
      "index": 4,
      "symbol": "S",
      "intensity": 674.1998624632421,
      "duration_ms": 1483.2396974191327,
      "fluence": 1.0,
      "K": 0.007416198487095662,
      "R_mean": 0.11800352410066724,
      "psi": -1.5372650314108545,
      "t": 4.9890789822279915
    },
    {
      "index": 5,
      "symbol": "L",
      "intensity": 1483.2396974191327,
      "duration_ms": 674.1998624632421,
      "fluence": 1.0,
      "K": 0.01631563667161046,
      "R_mean": 0.11909111083159385,
      "psi": 0.13276785973095254,
      "t": 5.663278844691233
    },
    {
      "index": 6,
      "symbol": "S",
      "intensity": 674.1998624632421,
      "duration_ms": 1483.2396974191327,
      "fluence": 1.0,
      "K": 0.007416198487095662,
      "R_mean": 0.23599456129377244,
      "psi": 1.04397690856616,
      "t": 7.146518542110366
    },
    {
      "index": 7,
      "symbol": "L",
      "intensity": 1483.2396974191327,
      "duration_ms": 674.1998624632421,
      "fluence": 1.0,
      "K": 0.01631563667161046,
      "R_mean": 0.31418037505361734,
      "psi": 1.5188007661701144,
      "t": 7.820718404573608
    },
    {
      "index": 8,
      "symbol": "L",
      "intensity": 1483.2396974191327,
      "duration_ms": 674.1998624632421,
      "fluence": 1.0,
      "K": 0.01631563667161046,
      "R_mean": 0.31836217109493875,
      "psi": 1.6983467958235383,
      "t": 8.49491826703685
    },
    {
      "index": 9,
      "symbol": "S",
      "intensity": 674.1998624632421,
      "duration_ms": 1483.2396974191327,
      "fluence": 1.0,
      "K": 0.007416198487095662,
      "R_mean": 0.2671888102048095,
      "psi": 1.810787529144366,
      "t": 9.978157964455983
    },
    {
      "index": 10,
      "symbol": "L",
      "intensity": 1483.2396974191327,
      "duration_ms": 674.1998624632421,
      "fluence": 1.0,
      "K": 0.01631563667161046,
      "R_mean": 0.20819115892097895,
      "psi": 1.6452840537513238,
      "t": 10.652357826919225
    },
    {
      "index": 11,
      "symbol": "L",
      "intensity": 1483.2396974191327,
      "duration_ms": 674.1998624632421,
      "fluence": 1.0,
      "K": 0.01631563667161046,
      "R_mean": 0.20469239356911492,
      "psi": 1.3720954861014154,
      "t": 11.326557689382467
    },
    {
      "index": 12,
      "symbol": "S",
      "intensity": 674.1998624632421,
      "duration_ms": 1483.2396974191327,
      "fluence": 1.0,
      "K": 0.007416198487095662,
      "R_mean": 0.2599183253582026,
      "psi": 1.0334399000480103,
      "t": 12.8097973868016
    },
    {
      "index": 13,
      "symbol": "L",
      "intensity": 1483.2396974191327,
      "duration_ms": 674.1998624632421,
      "fluence": 1.0,
      "K": 0.01631563667161046,
      "R_mean": 0.32887821416723517,
      "psi": 0.9299048251644598,
      "t": 13.483997249264842
    },
    {
      "index": 14,
      "symbol": "S",
      "intensity": 674.1998624632421,
      "duration_ms": 1483.2396974191327,
      "fluence": 1.0,
      "K": 0.007416198487095662,
      "R_mean": 0.349766805801855,
      "psi": 0.9617876279139574,
      "t": 14.967236946683975
    },
    {
      "index": 15,
      "symbol": "L",
      "intensity": 1483.2396974191327,
      "duration_ms": 674.1998624632421,
      "fluence": 1.0,
      "K": 0.01631563667161046,
      "R_mean": 0.34538413145145175,
      "psi": 0.9719715314427056,
      "t": 15.641436809147217
    },
    {
      "index": 16,
      "symbol": "L",
      "intensity": 1483.2396974191327,
      "duration_ms": 674.1998624632421,
      "fluence": 1.0,
      "K": 0.01631563667161046,
      "R_mean": 0.34630699951516036,
      "psi": 0.9833232353658855,
      "t": 16.31563667161046
    },
    {
      "index": 17,
      "symbol": "S",
      "intensity": 674.1998624632421,
      "duration_ms": 1483.2396974191327,
      "fluence": 1.0,
      "K": 0.007416198487095662,
      "R_mean": 0.3354509029946326,
      "psi": 1.1108515061384403,
      "t": 17.798876369029593
    },
    {
      "index": 18,
      "symbol": "L",
      "intensity": 1483.2396974191327,
      "duration_ms": 674.1998624632421,
      "fluence": 1.0,
      "K": 0.01631563667161046,
      "R_mean": 0.2897016183560367,
      "psi": 1.3326440498792524,
      "t": 18.473076231492836
    },
    {
      "index": 19,
      "symbol": "S",
      "intensity": 674.1998624632421,
      "duration_ms": 1483.2396974191327,
      "fluence": 1.0,
      "K": 0.007416198487095662,
      "R_mean": 0.21785296749763938,
      "psi": 1.569807329787724,
      "t": 19.95631592891197
    },
    {
      "index": 20,
      "symbol": "L",
      "intensity": 1483.2396974191327,
      "duration_ms": 674.1998624632421,
      "fluence": 1.0,
      "K": 0.01631563667161046,
      "R_mean": 0.1624468691350281,
      "psi": 1.741038690243104,
      "t": 20.630515791375213
    }
  ],
  "modes": [
    {
      "freq": 168.1804844912006,
      "l": 1,
      "m": -1,
      "amplitude": 0.24023496459216426,
      "phase": 1.810787529144366,
      "family": "biosentinel",
      "on": true,
      "visualFreq": 0.4005932958789677
    },
    {
      "freq": 163.03088576297708,
      "l": 2,
      "m": -1,
      "amplitude": 0.21368602151444052,
      "phase": 1.6452840537513238,
      "family": "biosentinel",
      "on": true,
      "visualFreq": 0.4013052509337289
    },
    {
      "freq": 162.7159968813093,
      "l": 3,
      "m": -1,
      "amplitude": 0.2121115771061017,
      "phase": 1.3720954861014154,
      "family": "biosentinel",
      "on": true,
      "visualFreq": 0.4013052509337289
    },
    {
      "freq": 167.52614085500596,
      "l": 4,
      "m": -1,
      "amplitude": 0.23696324641119115,
      "phase": 1.0334399000480103,
      "family": "biosentinel",
      "on": true,
      "visualFreq": 0.4005932958789677
    },
    {
      "freq": 173.89272073514013,
      "l": 5,
      "m": -1,
      "amplitude": 0.2679951963752558,
      "phase": 0.9299048251644598,
      "family": "biosentinel",
      "on": true,
      "visualFreq": 0.4013052509337289
    },
    {
      "freq": 175.61250409493468,
      "l": 6,
      "m": -1,
      "amplitude": 0.27739506261083474,
      "phase": 0.9617876279139574,
      "family": "biosentinel",
      "on": true,
      "visualFreq": 0.4005932958789677
    },
    {
      "freq": 175.37825329071964,
      "l": 7,
      "m": -1,
      "amplitude": 0.2754228591531533,
      "phase": 0.9719715314427056,
      "family": "biosentinel",
      "on": true,
      "visualFreq": 0.4013052509337289
    },
    {
      "freq": 175.4613114164534,
      "l": 1,
      "m": 0,
      "amplitude": 0.2758381497818222,
      "phase": 0.9833232353658855,
      "family": "biosentinel",
      "on": true,
      "visualFreq": 0.4013052509337289
    },
    {
      "freq": 174.32407284228466,
      "l": 2,
      "m": 1,
      "amplitude": 0.2709529063475847,
      "phase": 1.1108515061384403,
      "family": "biosentinel",
      "on": true,
      "visualFreq": 0.4005932958789677
    },
    {
      "freq": 170.36682711213228,
      "l": 3,
      "m": -1,
      "amplitude": 0.2503657282602165,
      "phase": 1.3326440498792524,
      "family": "biosentinel",
      "on": true,
      "visualFreq": 0.4013052509337289
    },
    {
      "freq": 163.74025864755527,
      "l": 4,
      "m": -3,
      "amplitude": 0.21803383537393772,
      "phase": 1.569807329787724,
      "family": "biosentinel",
      "on": true,
      "visualFreq": 0.4005932958789677
    },
    {
      "freq": 158.9138996822415,
      "l": 5,
      "m": -5,
      "amplitude": 0.19310109111076262,
      "phase": 1.741038690243104,
      "family": "biosentinel",
      "on": true,
      "visualFreq": 0.4013052509337289
    }
  ],
  "falsification": null
}
